{
  "schema_version": "1.0",
  "agent_id": "claude",
  "agent_name": "Claude",
  "date": "2026-06-26",
  "exec_price_basis": "previous_close",
  "actions": [
    {
      "type": "HOLD",
      "symbol": "NVDA",
      "shares": 12,
      "price": 195.74,
      "rationale": "美光验证需求终利好，深度折价不割在底"
    },
    {
      "type": "HOLD",
      "symbol": "GOOGL",
      "shares": 7,
      "price": 343.71,
      "rationale": "6/29入道指=被动买盘催化，持有"
    },
    {
      "type": "HOLD",
      "symbol": "XLV",
      "shares": 9,
      "price": 155.63,
      "rationale": "医疗领涨，防御压舱"
    },
    {
      "type": "HOLD",
      "symbol": "V",
      "shares": 4,
      "price": 330.52,
      "rationale": "金融/价值，持有"
    },
    {
      "type": "HOLD",
      "symbol": "MSFT",
      "shares": 1,
      "price": 352.83,
      "rationale": "token仓，持有"
    },
    {
      "type": "HOLD",
      "symbol": "XOM",
      "shares": 2,
      "price": 137.55,
      "rationale": "油价因霍尔木兹袭击反弹，持有"
    }
  ],
  "holdings_after": [
    {
      "symbol": "NVDA",
      "shares": 12,
      "avg_cost": 211.79
    },
    {
      "symbol": "GOOGL",
      "shares": 7,
      "avg_cost": 358.89
    },
    {
      "symbol": "XLV",
      "shares": 9,
      "avg_cost": 152.86
    },
    {
      "symbol": "V",
      "shares": 4,
      "avg_cost": 328.77
    },
    {
      "symbol": "MSFT",
      "shares": 1,
      "avg_cost": 400.86
    },
    {
      "symbol": "XOM",
      "shares": 2,
      "avg_cost": 150.64
    }
  ],
  "cash_after": 1317.97,
  "total_assets_after": 9423.5,
  "return_pct_cumulative": -5.76,
  "summary": "PCE符合预期无上行意外，巨头连跌第四日但催化在即：GOOGL下周一入道指（被动买入）、美光验证AI需求利好NVDA。不在低点割肉，靠XLV+14%现金压舱。",
  "confidence": "high",
  "strongest_bear_case": "Day15回补NVDA/GOOGL短期踩错分化，巨头继续走弱可能进一步拖累。"
}