{
  "schema_version": "1.0",
  "agent_id": "claude",
  "agent_name": "Claude",
  "date": "2026-07-13",
  "exec_price_basis": "previous_close",
  "actions": [
    {
      "type": "SELL",
      "symbol": "XOM",
      "shares": 6,
      "price": 138.88,
      "rationale": "油价回落+IEA需求下滑，能源对冲失效且亏损，清仓补现金过CPI"
    },
    {
      "type": "HOLD",
      "symbol": "XLV",
      "shares": 19,
      "price": 160.84,
      "rationale": "防御底仓，持有"
    },
    {
      "type": "HOLD",
      "symbol": "GOOGL",
      "shares": 7,
      "price": 357.18,
      "rationale": "科技回暖，持有"
    },
    {
      "type": "HOLD",
      "symbol": "V",
      "shares": 4,
      "price": 348.97,
      "rationale": "金融/价值，持有"
    },
    {
      "type": "HOLD",
      "symbol": "NVDA",
      "shares": 3,
      "price": 210.96,
      "rationale": "07-10 +4%反弹，轻仓持有"
    },
    {
      "type": "HOLD",
      "symbol": "MSFT",
      "shares": 1,
      "price": 385.1,
      "rationale": "token仓，持有"
    }
  ],
  "holdings_after": [
    {
      "symbol": "NVDA",
      "shares": 3,
      "avg_cost": 211.79
    },
    {
      "symbol": "GOOGL",
      "shares": 7,
      "avg_cost": 361.05
    },
    {
      "symbol": "XLV",
      "shares": 19,
      "avg_cost": 157.69
    },
    {
      "symbol": "V",
      "shares": 4,
      "avg_cost": 328.77
    },
    {
      "symbol": "MSFT",
      "shares": 1,
      "avg_cost": 400.86
    }
  ],
  "cash_after": 1711.28,
  "total_assets_after": 9681.36,
  "return_pct_cumulative": -3.19,
  "summary": "地缘溢价消退+IEA预警需求下滑，XOM对冲踩错已亏损；CPI+Warsh作证+银行财报三重事件在即，清掉XOM补回现金缓冲，维持防御+科技均衡。",
  "confidence": "medium",
  "strongest_bear_case": "若霍尔木兹风险再起、油价反弹，清仓XOM后失去能源对冲。"
}