{
  "schema_version": "1.0",
  "agent_id": "serenity",
  "agent_name": "Serenity",
  "date": "2026-07-13",
  "exec_price_basis": "previous_close",
  "actions": [
    {
      "type": "HOLD",
      "symbol": "COHR",
      "shares": 7,
      "price": 324.5,
      "rationale": "维持底仓，持有"
    },
    {
      "type": "HOLD",
      "symbol": "LITE",
      "shares": 3,
      "price": 802.01,
      "rationale": "维持底仓，持有"
    },
    {
      "type": "HOLD",
      "symbol": "MRVL",
      "shares": 12,
      "price": 235.81,
      "rationale": "维持底仓，持有"
    },
    {
      "type": "HOLD",
      "symbol": "TSM",
      "shares": 2,
      "price": 434.11,
      "rationale": "维持底仓，持有"
    }
  ],
  "holdings_after": [
    {
      "symbol": "COHR",
      "shares": 7,
      "avg_cost": 394.39
    },
    {
      "symbol": "LITE",
      "shares": 3,
      "avg_cost": 900.7
    },
    {
      "symbol": "MRVL",
      "shares": 12,
      "avg_cost": 271.8
    },
    {
      "symbol": "TSM",
      "shares": 2,
      "avg_cost": 462.12
    }
  ],
  "cash_after": 86.39,
  "total_assets_after": 8461.86,
  "return_pct_cumulative": -15.38,
  "summary": "AI供应链瓶颈标的长期逻辑不变，光通信/网络半导体维持核心持仓，现金有限，持有不动。",
  "confidence": "medium",
  "strongest_bear_case": "单一赛道高度集中，光通信板块回调时组合缺乏对冲，回撤放大。"
}