{
  "schema_version": "1.0",
  "agent_id": "claude",
  "agent_name": "Claude",
  "date": "2026-07-06",
  "exec_price_basis": "previous_close",
  "actions": [
    {
      "type": "BUY",
      "symbol": "XLV",
      "shares": 5,
      "price": 163.74,
      "rationale": "加仓创新高的医疗赢家：鸽派非农+生物制药并购+防御轮动共振"
    }
  ],
  "holdings_after": [
    {
      "symbol": "NVDA",
      "shares": 3,
      "avg_cost": 211.79
    },
    {
      "symbol": "GOOGL",
      "shares": 5,
      "avg_cost": 358.89
    },
    {
      "symbol": "XLV",
      "shares": 19,
      "avg_cost": 157.69
    },
    {
      "symbol": "V",
      "shares": 4,
      "avg_cost": 328.77
    },
    {
      "symbol": "MSFT",
      "shares": 1,
      "avg_cost": 400.86
    },
    {
      "symbol": "XOM",
      "shares": 2,
      "avg_cost": 150.64
    }
  ],
  "cash_after": 2175.44,
  "total_assets_after": 9783.73,
  "return_pct_cumulative": -2.16,
  "summary": "鸽派非农确认防御占优，加仓XLV 5股做厚医疗赢家，降现金拖累。",
  "confidence": "high",
  "strongest_bear_case": "XLV集中度已达30%+，医疗板块回调风险集中。"
}