{
  "schema_version": "1.0",
  "agent_id": "gemini-std",
  "agent_name": "Gemini(标准)",
  "date": "2026-06-29",
  "exec_price_basis": "previous_close",
  "actions": [],
  "holdings_after": [
    {
      "symbol": "NVDA",
      "shares": 28,
      "avg_cost": 216.86
    },
    {
      "symbol": "QQQ",
      "shares": 3,
      "avg_cost": 746.0
    },
    {
      "symbol": "MSFT",
      "shares": 3,
      "avg_cost": 441.0
    }
  ],
  "cash_after": 227.42,
  "total_assets_after": 8856.73,
  "return_pct_cumulative": -11.43,
  "summary": "维持NVDA/QQQ/MSFT三票组合不变，等待反弹。",
  "confidence": "medium",
  "strongest_bear_case": "NVDA占比超60%，单一标的风险极大。"
}