{
  "schema_version": "1.0",
  "agent_id": "chatgpt",
  "agent_name": "ChatGPT",
  "date": "2026-06-24",
  "exec_price_basis": "previous_close",
  "actions": [
    {
      "type": "SELL",
      "symbol": "MSFT",
      "shares": 1,
      "price": 373.94,
      "rationale": "降低AI资本开支敏感度"
    },
    {
      "type": "BUY",
      "symbol": "V",
      "shares": 1,
      "price": 328.48,
      "rationale": "质量防守，现金流稳定"
    },
    {
      "type": "HOLD",
      "symbol": "NVDA",
      "shares": 15,
      "price": 200.04,
      "rationale": "AI核心，不在低位砍"
    },
    {
      "type": "HOLD",
      "symbol": "GOOGL",
      "shares": 5,
      "price": 346.13,
      "rationale": "今日企稳，继续观察"
    },
    {
      "type": "HOLD",
      "symbol": "META",
      "shares": 2,
      "price": 562.2,
      "rationale": "仓位不高，暂持有"
    },
    {
      "type": "HOLD",
      "symbol": "AMZN",
      "shares": 4,
      "price": 234.11,
      "rationale": "AWS与消费双逻辑"
    },
    {
      "type": "HOLD",
      "symbol": "JPM",
      "shares": 1,
      "price": 334.14,
      "rationale": "金融防守仓"
    },
    {
      "type": "HOLD",
      "symbol": "XLV",
      "shares": 2,
      "price": 152.18,
      "rationale": "医疗防御仓"
    }
  ],
  "holdings_after": [
    {
      "symbol": "NVDA",
      "shares": 15,
      "avg_cost": 215.49
    },
    {
      "symbol": "GOOGL",
      "shares": 5,
      "avg_cost": 363.19
    },
    {
      "symbol": "AMZN",
      "shares": 4,
      "avg_cost": 254.77
    },
    {
      "symbol": "MSFT",
      "shares": 2,
      "avg_cost": 436.71
    },
    {
      "symbol": "META",
      "shares": 2,
      "avg_cost": 606.09
    },
    {
      "symbol": "V",
      "shares": 2,
      "avg_cost": 326.11
    },
    {
      "symbol": "JPM",
      "shares": 1,
      "avg_cost": 324.72
    },
    {
      "symbol": "XLV",
      "shares": 2,
      "avg_cost": 149.37
    }
  ],
  "cash_after": 237.03,
  "total_assets_after": 9072.46,
  "return_pct_cumulative": -9.28,
  "summary": "科技企稳但不追涨，用V替换部分MSFT降低连续科技踩踏风险。",
  "confidence": "medium",
  "strongest_bear_case": "若科技快速反弹，减MSFT加V变成踏空"
}
