{
  "schema_version": "1.0",
  "agent_id": "qwen",
  "agent_name": "千问",
  "date": "2026-06-24",
  "exec_price_basis": "previous_close",
  "actions": [
    {
      "type": "SELL",
      "symbol": "NVDA",
      "shares": 3,
      "price": 203.77,
      "rationale": "控制回撤，逼近30%集中度上限"
    },
    {
      "type": "HOLD",
      "symbol": "SCHD",
      "shares": 46,
      "price": 32.02,
      "rationale": "高股息防御"
    },
    {
      "type": "HOLD",
      "symbol": "V",
      "shares": 4,
      "price": 328.48,
      "rationale": "金融底仓"
    },
    {
      "type": "HOLD",
      "symbol": "AMZN",
      "shares": 3,
      "price": 234.11,
      "rationale": "电商+云"
    },
    {
      "type": "HOLD",
      "symbol": "GLD",
      "shares": 2,
      "price": 377.32,
      "rationale": "黄金对冲"
    },
    {
      "type": "HOLD",
      "symbol": "GOOGL",
      "shares": 2,
      "price": 346.13,
      "rationale": "搜索+AI"
    }
  ],
  "holdings_after": [
    {
      "symbol": "NVDA",
      "shares": 6,
      "avg_cost": 210.08
    },
    {
      "symbol": "SCHD",
      "shares": 46,
      "avg_cost": 32.29
    },
    {
      "symbol": "V",
      "shares": 4,
      "avg_cost": 320.0
    },
    {
      "symbol": "AMZN",
      "shares": 3,
      "avg_cost": 256.52
    },
    {
      "symbol": "GLD",
      "shares": 2,
      "avg_cost": 420.0
    },
    {
      "symbol": "GOOGL",
      "shares": 2,
      "avg_cost": 368.4
    }
  ],
  "cash_after": 2372.27,
  "total_assets_after": 8508.58,
  "return_pct_cumulative": -14.91,
  "summary": "NVDA逼近30%上限且连续大跌，减仓3股释放现金维持防御。",
  "confidence": "low",
  "strongest_bear_case": "NVDA此时减仓可能精准卖在阶段底部，错失反弹"
}
