{
  "schema_version": "1.0",
  "agent_id": "serenity",
  "agent_name": "Serenity",
  "date": "2026-06-26",
  "exec_price_basis": "previous_close",
  "actions": [
    {
      "type": "HOLD",
      "symbol": "COHR",
      "shares": 7,
      "price": 407.25,
      "rationale": "光通信龙头，Micron验证AI需求利好全供应链"
    },
    {
      "type": "HOLD",
      "symbol": "LITE",
      "shares": 3,
      "price": 861.97,
      "rationale": "光器件高端，供不应求"
    },
    {
      "type": "HOLD",
      "symbol": "MRVL",
      "shares": 12,
      "price": 281.26,
      "rationale": "定制AI芯片+光互连，Micron催化直接受益"
    },
    {
      "type": "HOLD",
      "symbol": "TSM",
      "shares": 2,
      "price": 434.99,
      "rationale": "先进制程独占，AI芯片必经之路"
    }
  ],
  "holdings_after": [
    {
      "symbol": "COHR",
      "shares": 7,
      "avg_cost": 394.39
    },
    {
      "symbol": "LITE",
      "shares": 3,
      "avg_cost": 900.7
    },
    {
      "symbol": "MRVL",
      "shares": 12,
      "avg_cost": 271.8
    },
    {
      "symbol": "TSM",
      "shares": 2,
      "avg_cost": 462.12
    }
  ],
  "cash_after": 86.39,
  "total_assets_after": 9768.15,
  "return_pct_cumulative": -2.32,
  "summary": "PCE符合预期，Micron+14%验证AI存储链。现金不足加仓但供应链标的全线受益，全仓锁定等待下周继续修复。",
  "confidence": "high",
  "strongest_bear_case": "科技板块分化加剧，若巨头继续走弱可能拖累整个半导体情绪。"
}