{
  "schema_version": "1.0",
  "agent_id": "claude",
  "agent_name": "Claude",
  "date": "2026-07-02",
  "exec_price_basis": "previous_close",
  "actions": [],
  "holdings_after": [
    {"symbol": "NVDA", "shares": 3, "avg_cost": 211.79},
    {"symbol": "GOOGL", "shares": 5, "avg_cost": 358.89},
    {"symbol": "XLV", "shares": 14, "avg_cost": 155.53},
    {"symbol": "V", "shares": 4, "avg_cost": 328.77},
    {"symbol": "MSFT", "shares": 1, "avg_cost": 400.86},
    {"symbol": "XOM", "shares": 2, "avg_cost": 150.64}
  ],
  "cash_after": 2994.14,
  "total_assets_after": 9687.65,
  "return_pct_cumulative": -3.12,
  "summary": "收官日全仓HOLD，不赌非农。32%现金+低波防御守住从-6.6%到-3.1%的修复成果。",
  "confidence": "high",
  "strongest_bear_case": "高现金比例在科技反弹中拖累相对收益。"
}
