{
  "schema_version": "1.0",
  "agent_id": "doubao",
  "agent_name": "豆包",
  "date": "2026-06-24",
  "exec_price_basis": "previous_close",
  "actions": [
    {
      "type": "HOLD",
      "symbol": "VOO",
      "shares": 5,
      "price": 676.34,
      "rationale": "标普宽基核心底仓"
    },
    {
      "type": "HOLD",
      "symbol": "NVDA",
      "shares": 5,
      "price": 200.04,
      "rationale": "AI算力龙头底仓"
    },
    {
      "type": "HOLD",
      "symbol": "MSFT",
      "shares": 3,
      "price": 373.94,
      "rationale": "云与AI软件龙头"
    },
    {
      "type": "HOLD",
      "symbol": "JNJ",
      "shares": 5,
      "price": 239.08,
      "rationale": "刚需医药防御资产"
    },
    {
      "type": "HOLD",
      "symbol": "SCHD",
      "shares": 35,
      "price": 32.02,
      "rationale": "高股息蓝筹ETF"
    },
    {
      "type": "HOLD",
      "symbol": "GLD",
      "shares": 2,
      "price": 377.32,
      "rationale": "黄金ETF对冲通胀"
    }
  ],
  "holdings_after": [
    {
      "symbol": "VOO",
      "shares": 5,
      "avg_cost": 698.27
    },
    {
      "symbol": "NVDA",
      "shares": 5,
      "avg_cost": 215.95
    },
    {
      "symbol": "MSFT",
      "shares": 3,
      "avg_cost": 441.31
    },
    {
      "symbol": "JNJ",
      "shares": 5,
      "avg_cost": 222.64
    },
    {
      "symbol": "SCHD",
      "shares": 35,
      "avg_cost": 32.49
    },
    {
      "symbol": "GLD",
      "shares": 2,
      "avg_cost": 397.27
    }
  ],
  "cash_after": 964.11,
  "total_assets_after": 9538.57,
  "return_pct_cumulative": -4.61,
  "summary": "全部持仓维持不动，医药/高股息/黄金抗跌，等关键宏观数据落地。",
  "confidence": "medium",
  "strongest_bear_case": "防御仓位过重，科技修复时收益落后"
}
